<?xml version="1.0" encoding="UTF-8"?>
<!DOCTYPE test [
<!ELEMENT test (question+)>
<!ELEMENT question (wording,choices)>
<!ELEMENT wording (#PCDATA)>
<!ELEMENT choices (choice+)>
<!ELEMENT choice (#PCDATA)>
<!ATTLIST question id CDATA #REQUIRED>
<!ATTLIST choice correct (yes|no) "no">
]>

<test>

<question id="1"><wording>What muscle do squats work?</wording><choices><choice correct="yes">Legs</choice><choice>Arms</choice><choice>Back</choice><choice>Neck</choice></choices></question>

<question id="2"><wording>Which exercise is for chest?</wording><choices><choice correct="yes">Bench press</choice><choice>Squat</choice><choice>Pull-ups</choice><choice>Running</choice></choices></question>

<question id="3"><wording>What improves endurance?</wording><choices><choice correct="yes">Cardio</choice><choice>Weights</choice><choice>Yoga</choice><choice>Rest</choice></choices></question>

<question id="4"><wording>How many days should you train?</wording><choices><choice correct="yes">3-5 days</choice><choice>1 day</choice><choice>7 days</choice><choice>Never</choice></choices></question>

<!-- continúa igual hasta 20 -->

<question id="20"><wording>What hydrates the body?</wording><choices><choice correct="yes">Water</choice><choice>Soda</choice><choice>Coffee</choice><choice>Alcohol</choice></choices></question>

</test>
